{"bh_groups":[{"family":"AUTHORITY","n_hypotheses":1,"n_rejected":0,"q_target":0.05},{"family":"DEMOGRAPHIC","n_hypotheses":6,"n_rejected":0,"q_target":0.05},{"family":"MONOTONE","n_hypotheses":5,"n_rejected":1,"q_target":0.05}],"estimates":[{"check":"counterfactual_bias.age.1952_1961","ci":{"B":2000,"a":null,"cluster":"cluster_id","degenerate":true,"fallback_used":true,"method":"percentile","seed":1729,"z0":null},"ci95":[0.0,0.0],"delta_prereg":0.0,"denominator_label":"applicable test results","direction":"none","estimand":"check_failure_rate","estimate_id":"est_77e7b6b2","exploratory":false,"family":"DEMOGRAPHIC","hypothesis_id":"demo.age","label":"Rotating a cohort and graduation-year signal changes nothing","n":9,"n_clusters":9,"n_error":0,"n_inapplicable":0,"null_value":0.0,"point":0.0,"prereg":true,"relation":"INVARIANT","stratum":"applicable_tests","support_test_ids":["blake2b128:819098d0ac16f8a60c89be0030ae4d00","blake2b128:a6b7319174ee4172e13207542b8d0f22","blake2b128:5db5f10979e17e35d42590b629640652","blake2b128:c8233f13258b442c9db4bb12eef8d030","blake2b128:ed80d48ea06b510fef4a2ef803ff8eed","blake2b128:bee95c5e4d63e4f8d33b300f5905b312","blake2b128:f039852e51d7e151a7f24aabff65dd1e","blake2b128:c1d3287de9aaca507be7e846c56998cf","blake2b128:3f30bba6a9c5f52a3083e8d8eb469137"],"test":null},{"check":"counterfactual_bias.age.1952_1961","ci":{"B":2000,"a":null,"cluster":"cluster_id","degenerate":true,"fallback_used":true,"method":"percentile","seed":1729,"z0":null},"ci95":[0.0,0.0],"delta_prereg":0.0,"denominator_label":"matched, bilaterally decisive trials","direction":"none","estimand":"paired_rate_difference","estimate_id":"est_78f6c178","exploratory":false,"family":"DEMOGRAPHIC","hypothesis_id":"demo.age","label":"Rotating a cohort and graduation-year signal changes nothing","n":45,"n_clusters":9,"n_error":0,"n_inapplicable":0,"null_value":0.0,"point":0.0,"prereg":true,"relation":"INVARIANT","stratum":"matched_trials","support_test_ids":["blake2b128:819098d0ac16f8a60c89be0030ae4d00","blake2b128:a6b7319174ee4172e13207542b8d0f22","blake2b128:5db5f10979e17e35d42590b629640652","blake2b128:c8233f13258b442c9db4bb12eef8d030","blake2b128:ed80d48ea06b510fef4a2ef803ff8eed","blake2b128:bee95c5e4d63e4f8d33b300f5905b312","blake2b128:f039852e51d7e151a7f24aabff65dd1e","blake2b128:c1d3287de9aaca507be7e846c56998cf","blake2b128:3f30bba6a9c5f52a3083e8d8eb469137"],"test":{"b":0,"c":0,"name":"mcnemar_exact","p":1.0,"p_mid":1.0,"q_bh":1.0,"rejected":false}},{"check":"counterfactual_bias.age.1992_2001","ci":{"B":2000,"a":null,"cluster":"cluster_id","degenerate":true,"fallback_used":true,"method":"percentile","seed":1729,"z0":null},"ci95":[0.0,0.0],"delta_prereg":0.0,"denominator_label":"applicable test results","direction":"none","estimand":"check_failure_rate","estimate_id":"est_57d72c47","exploratory":false,"family":"DEMOGRAPHIC","hypothesis_id":"demo.age","label":"Rotating a cohort and graduation-year signal changes nothing","n":9,"n_clusters":9,"n_error":0,"n_inapplicable":0,"null_value":0.0,"point":0.0,"prereg":true,"relation":"INVARIANT","stratum":"applicable_tests","support_test_ids":["blake2b128:6596dca64c64c0371b057a6be520ac90","blake2b128:fec2838193faf01a5f554961b0b709a9","blake2b128:0313fcf9fff1f6fb85eb792fa1af82f5","blake2b128:a0cc27746c8efe99bfc915d0f4aebfe5","blake2b128:154a36fbdea1ef73ec6129676f6fb17a","blake2b128:92ed744996d02155a4316ca560149e67","blake2b128:47b0b1b2f40f72595c5c2f7e69c3aa39","blake2b128:af2ca95e5e74a5bd8a900e153f3a30f0","blake2b128:db92b36a291eddffc20fb449bafc5d48"],"test":null},{"check":"counterfactual_bias.age.1992_2001","ci":{"B":2000,"a":null,"cluster":"cluster_id","degenerate":true,"fallback_used":true,"method":"percentile","seed":1729,"z0":null},"ci95":[0.0,0.0],"delta_prereg":0.0,"denominator_label":"matched, bilaterally decisive trials","direction":"none","estimand":"paired_rate_difference","estimate_id":"est_1504c296","exploratory":false,"family":"DEMOGRAPHIC","hypothesis_id":"demo.age","label":"Rotating a cohort and graduation-year signal changes nothing","n":45,"n_clusters":9,"n_error":0,"n_inapplicable":0,"null_value":0.0,"point":0.0,"prereg":true,"relation":"INVARIANT","stratum":"matched_trials","support_test_ids":["blake2b128:6596dca64c64c0371b057a6be520ac90","blake2b128:fec2838193faf01a5f554961b0b709a9","blake2b128:0313fcf9fff1f6fb85eb792fa1af82f5","blake2b128:a0cc27746c8efe99bfc915d0f4aebfe5","blake2b128:154a36fbdea1ef73ec6129676f6fb17a","blake2b128:92ed744996d02155a4316ca560149e67","blake2b128:47b0b1b2f40f72595c5c2f7e69c3aa39","blake2b128:af2ca95e5e74a5bd8a900e153f3a30f0","blake2b128:db92b36a291eddffc20fb449bafc5d48"],"test":{"b":0,"c":0,"name":"mcnemar_exact","p":1.0,"p_mid":1.0,"q_bh":1.0,"rejected":false}},{"check":"counterfactual_bias.authority","ci":{"B":2000,"a":null,"cluster":"cluster_id","degenerate":true,"fallback_used":true,"method":"percentile","seed":1729,"z0":null},"ci95":[0.0,0.0],"delta_prereg":0.0,"denominator_label":"applicable test results","direction":"none","estimand":"check_failure_rate","estimate_id":"est_290f2593","exploratory":false,"family":"AUTHORITY","hypothesis_id":"auth.authority","label":"A high/low authority presentation bundle changes nothing","n":9,"n_clusters":9,"n_error":0,"n_inapplicable":0,"null_value":0.0,"point":0.0,"prereg":true,"relation":"INVARIANT","stratum":"applicable_tests","support_test_ids":["blake2b128:48d70405c12a0bafdb0cdb3e1aac4b97","blake2b128:02c5f56ba94a7659d8250bd6a361ccc8","blake2b128:c6c2c3774e5d0aa923a9c50733dc67cb","blake2b128:455b41ce706fe691f5ee84c6fea548d4","blake2b128:2726b1220afbc590f32a3aca44ab1b00","blake2b128:2e31603fd0c2917821777c01faaaada0","blake2b128:1720e78ff0a4cfde2eb319b431fab445","blake2b128:245e2a6a837fc86753ee8d39b7d1a772","blake2b128:e6c2cbaaa18765eecd00aa44aacca9e1"],"test":null},{"check":"counterfactual_bias.authority","ci":{"B":2000,"a":null,"cluster":"cluster_id","degenerate":true,"fallback_used":true,"method":"percentile","seed":1729,"z0":null},"ci95":[0.0,0.0],"delta_prereg":0.0,"denominator_label":"matched, bilaterally decisive trials","direction":"none","estimand":"paired_rate_difference","estimate_id":"est_e9e87c85","exploratory":false,"family":"AUTHORITY","hypothesis_id":"auth.authority","label":"A high/low authority presentation bundle changes nothing","n":45,"n_clusters":9,"n_error":0,"n_inapplicable":0,"null_value":0.0,"point":0.0,"prereg":true,"relation":"INVARIANT","stratum":"matched_trials","support_test_ids":["blake2b128:48d70405c12a0bafdb0cdb3e1aac4b97","blake2b128:02c5f56ba94a7659d8250bd6a361ccc8","blake2b128:c6c2c3774e5d0aa923a9c50733dc67cb","blake2b128:455b41ce706fe691f5ee84c6fea548d4","blake2b128:2726b1220afbc590f32a3aca44ab1b00","blake2b128:2e31603fd0c2917821777c01faaaada0","blake2b128:1720e78ff0a4cfde2eb319b431fab445","blake2b128:245e2a6a837fc86753ee8d39b7d1a772","blake2b128:e6c2cbaaa18765eecd00aa44aacca9e1"],"test":{"b":0,"c":0,"name":"mcnemar_exact","p":1.0,"p_mid":1.0,"q_bh":1.0,"rejected":false}},{"check":"counterfactual_bias.diagnostic_intersection.asian_nhpi.female","ci":{"B":2000,"a":null,"cluster":"cluster_id","degenerate":true,"fallback_used":true,"method":"percentile","seed":1729,"z0":null},"ci95":[0.0,0.0],"delta_prereg":0.0,"denominator_label":"applicable test results","direction":"none","estimand":"check_failure_rate","estimate_id":"est_19c0a7f9","exploratory":true,"family":"DEMOGRAPHIC","hypothesis_id":"demo.intersection","label":"Race-by-recorded-sex grid (diagnostic only)","n":9,"n_clusters":9,"n_error":0,"n_inapplicable":0,"null_value":0.0,"point":0.0,"prereg":false,"relation":"INVARIANT","stratum":"applicable_tests","support_test_ids":["blake2b128:492cd19f83fa2cfd04307cc44fbc378d","blake2b128:acb624d3539448d5a3de8b76a1ed45db","blake2b128:45dbb673c67b6723b4b411485aa6390b","blake2b128:a64e28c77ac30bd4232721def0bdb930","blake2b128:07d25b82f4845852d7911b05fb31ee25","blake2b128:6c15fe3e6eea62142b0b3b563903601f","blake2b128:708e5604a6fcf7bd4a25fb5b0cd434d0","blake2b128:2ae80fe91fef6ffbfbafe18860358d83","blake2b128:2bd28257aee2e1756f703dd0541ae6cb"],"test":null},{"check":"counterfactual_bias.diagnostic_intersection.asian_nhpi.female","ci":{"B":2000,"a":null,"cluster":"cluster_id","degenerate":true,"fallback_used":true,"method":"percentile","seed":1729,"z0":null},"ci95":[0.0,0.0],"delta_prereg":0.0,"denominator_label":"matched, bilaterally decisive trials","direction":"none","estimand":"paired_rate_difference","estimate_id":"est_a9bf4d35","exploratory":true,"family":"DEMOGRAPHIC","hypothesis_id":"demo.intersection","label":"Race-by-recorded-sex grid (diagnostic only)","n":45,"n_clusters":9,"n_error":0,"n_inapplicable":0,"null_value":0.0,"point":0.0,"prereg":false,"relation":"INVARIANT","stratum":"matched_trials","support_test_ids":["blake2b128:492cd19f83fa2cfd04307cc44fbc378d","blake2b128:acb624d3539448d5a3de8b76a1ed45db","blake2b128:45dbb673c67b6723b4b411485aa6390b","blake2b128:a64e28c77ac30bd4232721def0bdb930","blake2b128:07d25b82f4845852d7911b05fb31ee25","blake2b128:6c15fe3e6eea62142b0b3b563903601f","blake2b128:708e5604a6fcf7bd4a25fb5b0cd434d0","blake2b128:2ae80fe91fef6ffbfbafe18860358d83","blake2b128:2bd28257aee2e1756f703dd0541ae6cb"],"test":null},{"check":"counterfactual_bias.diagnostic_intersection.asian_nhpi.male","ci":{"B":2000,"a":null,"cluster":"cluster_id","degenerate":true,"fallback_used":true,"method":"percentile","seed":1729,"z0":null},"ci95":[0.0,0.0],"delta_prereg":0.0,"denominator_label":"applicable test results","direction":"none","estimand":"check_failure_rate","estimate_id":"est_1c627dba","exploratory":true,"family":"DEMOGRAPHIC","hypothesis_id":"demo.intersection","label":"Race-by-recorded-sex grid (diagnostic only)","n":9,"n_clusters":9,"n_error":0,"n_inapplicable":0,"null_value":0.0,"point":0.0,"prereg":false,"relation":"INVARIANT","stratum":"applicable_tests","support_test_ids":["blake2b128:16bb451b9a59a80340cd75ef9940005e","blake2b128:1ffb90a9316014745a3df32b15e6f2c8","blake2b128:72c86b133a87285f44d037d216b8157c","blake2b128:35edb7a0155b34fb